{
  "version": 1,
  "area_slug": "loyang_outskirts",
  "balance_metadata": {
    "planned_level_range": [
      1,
      12
    ],
    "notes": [
      "Pilot structured content layer seeded from existing runtime files.",
      "Topology remains owned by map.md + mapmd-json."
    ]
  },
  "mob_files": [
    {
      "relative_path": "area/loyang_outskirts/mob/7601.mob",
      "document": [
        {
          "kind": "field",
          "key": "Vnum",
          "value": "7601"
        },
        {
          "kind": "field",
          "key": "Name",
          "value": "roadside tea seller~"
        },
        {
          "kind": "field",
          "key": "ShortDesc",
          "value": "路亭茶販~"
        },
        {
          "kind": "block_field",
          "key": "Description",
          "lines": [
            "一名在東郊路亭做小買賣的茶販守著他的木桶與陶杯﹐不時伸長脖子",
            "往西看看橋頭和來路﹐像是在確認今天是否還會有更多旅人經過。"
          ],
          "terminator_style": "line"
        },
        {
          "kind": "field",
          "key": "Sentinel",
          "value": "Yes"
        },
        {
          "kind": "field",
          "key": "StayArea",
          "value": "Yes"
        },
        {
          "kind": "field",
          "key": "NoKill",
          "value": "Yes"
        },
        {
          "kind": "field",
          "key": "Alignment",
          "value": "50"
        },
        {
          "kind": "field",
          "key": "Level",
          "value": "8"
        },
        {
          "kind": "field",
          "key": "Hitroll",
          "value": "0"
        },
        {
          "kind": "field",
          "key": "Protect",
          "value": "0"
        },
        {
          "kind": "field",
          "key": "Damroll",
          "value": "0"
        },
        {
          "kind": "field",
          "key": "Str",
          "value": "10"
        },
        {
          "kind": "field",
          "key": "Int",
          "value": "12"
        },
        {
          "kind": "field",
          "key": "Wis",
          "value": "12"
        },
        {
          "kind": "field",
          "key": "Dex",
          "value": "10"
        },
        {
          "kind": "field",
          "key": "Con",
          "value": "10"
        },
        {
          "kind": "field",
          "key": "Hp",
          "value": "800"
        },
        {
          "kind": "field",
          "key": "Mana",
          "value": "100"
        },
        {
          "kind": "field",
          "key": "Move",
          "value": "100"
        },
        {
          "kind": "field",
          "key": "Class",
          "value": "0"
        },
        {
          "kind": "field",
          "key": "Gold",
          "value": "50"
        },
        {
          "kind": "field",
          "key": "Multipile",
          "value": "100"
        },
        {
          "kind": "field",
          "key": "AttackRatio",
          "value": "100"
        },
        {
          "kind": "field",
          "key": "DodgeRatio",
          "value": "100"
        },
        {
          "kind": "field",
          "key": "Migrate",
          "value": "0"
        },
        {
          "kind": "field",
          "key": "Speak",
          "value": "YES"
        },
        {
          "kind": "field",
          "key": "Sex",
          "value": "SEX_MALE"
        }
      ]
    },
    {
      "relative_path": "area/loyang_outskirts/mob/7602.mob",
      "document": [
        {
          "kind": "field",
          "key": "Vnum",
          "value": "7602"
        },
        {
          "kind": "field",
          "key": "Name",
          "value": "east gate patrol soldier~"
        },
        {
          "kind": "field",
          "key": "ShortDesc",
          "value": "東郊巡檢兵~"
        },
        {
          "kind": "block_field",
          "key": "Description",
          "lines": [
            "一名披著半舊皮甲的巡檢兵站得筆直﹐手總是不自覺按在腰間刀柄附",
            "近。看得出他已在東郊路上來回巡了很久﹐對每一個停在告示牌前太",
            "久的人都多看兩眼。"
          ],
          "terminator_style": "line"
        },
        {
          "kind": "field",
          "key": "Sentinel",
          "value": "Yes"
        },
        {
          "kind": "field",
          "key": "StayArea",
          "value": "Yes"
        },
        {
          "kind": "field",
          "key": "Alignment",
          "value": "150"
        },
        {
          "kind": "field",
          "key": "Level",
          "value": "10"
        },
        {
          "kind": "field",
          "key": "Hitroll",
          "value": "3"
        },
        {
          "kind": "field",
          "key": "Protect",
          "value": "-2"
        },
        {
          "kind": "field",
          "key": "Damroll",
          "value": "2"
        },
        {
          "kind": "field",
          "key": "Str",
          "value": "12"
        },
        {
          "kind": "field",
          "key": "Int",
          "value": "10"
        },
        {
          "kind": "field",
          "key": "Wis",
          "value": "10"
        },
        {
          "kind": "field",
          "key": "Dex",
          "value": "11"
        },
        {
          "kind": "field",
          "key": "Con",
          "value": "11"
        },
        {
          "kind": "field",
          "key": "Hp",
          "value": "1200"
        },
        {
          "kind": "field",
          "key": "Mana",
          "value": "100"
        },
        {
          "kind": "field",
          "key": "Move",
          "value": "100"
        },
        {
          "kind": "field",
          "key": "Class",
          "value": "CLASS_THIEF"
        },
        {
          "kind": "field",
          "key": "Gold",
          "value": "80"
        },
        {
          "kind": "field",
          "key": "Multipile",
          "value": "100"
        },
        {
          "kind": "field",
          "key": "AttackRatio",
          "value": "100"
        },
        {
          "kind": "field",
          "key": "DodgeRatio",
          "value": "100"
        },
        {
          "kind": "field",
          "key": "Migrate",
          "value": "0"
        },
        {
          "kind": "field",
          "key": "Speak",
          "value": "YES"
        },
        {
          "kind": "field",
          "key": "Sex",
          "value": "SEX_MALE"
        }
      ]
    },
    {
      "relative_path": "area/loyang_outskirts/mob/7603.mob",
      "document": [
        {
          "kind": "field",
          "key": "Vnum",
          "value": "7603"
        },
        {
          "kind": "field",
          "key": "Name",
          "value": "canal skulker looter~"
        },
        {
          "kind": "field",
          "key": "ShortDesc",
          "value": "渠邊流寇~"
        },
        {
          "kind": "block_field",
          "key": "Description",
          "lines": [
            "這名流寇縮著肩膀蹲在陰影邊緣﹐眼神不時在田埂、農舍和暗井口之",
            "間游移。他顯然熟悉這附近巡檢變少的時段﹐手上的短刀也已磨得發",
            "亮。"
          ],
          "terminator_style": "line"
        },
        {
          "kind": "field",
          "key": "StayArea",
          "value": "Yes"
        },
        {
          "kind": "field",
          "key": "Wimpy",
          "value": "Yes"
        },
        {
          "kind": "field",
          "key": "AlignEvil",
          "value": "Yes"
        },
        {
          "kind": "field",
          "key": "Alignment",
          "value": "-200"
        },
        {
          "kind": "field",
          "key": "Level",
          "value": "11"
        },
        {
          "kind": "field",
          "key": "Hitroll",
          "value": "4"
        },
        {
          "kind": "field",
          "key": "Protect",
          "value": "-1"
        },
        {
          "kind": "field",
          "key": "Damroll",
          "value": "3"
        },
        {
          "kind": "field",
          "key": "Str",
          "value": "12"
        },
        {
          "kind": "field",
          "key": "Int",
          "value": "9"
        },
        {
          "kind": "field",
          "key": "Wis",
          "value": "8"
        },
        {
          "kind": "field",
          "key": "Dex",
          "value": "12"
        },
        {
          "kind": "field",
          "key": "Con",
          "value": "11"
        },
        {
          "kind": "field",
          "key": "Hp",
          "value": "1400"
        },
        {
          "kind": "field",
          "key": "Mana",
          "value": "60"
        },
        {
          "kind": "field",
          "key": "Move",
          "value": "120"
        },
        {
          "kind": "field",
          "key": "Class",
          "value": "CLASS_THIEF"
        },
        {
          "kind": "field",
          "key": "Gold",
          "value": "120"
        },
        {
          "kind": "field",
          "key": "Multipile",
          "value": "100"
        },
        {
          "kind": "field",
          "key": "AttackRatio",
          "value": "105"
        },
        {
          "kind": "field",
          "key": "DodgeRatio",
          "value": "105"
        },
        {
          "kind": "field",
          "key": "Migrate",
          "value": "0"
        },
        {
          "kind": "field",
          "key": "Sex",
          "value": "SEX_MALE"
        }
      ]
    }
  ],
  "obj_files": [
    {
      "relative_path": "area/loyang_outskirts/obj/7651.obj",
      "document": [
        {
          "kind": "field",
          "key": "Vnum",
          "value": "7651"
        },
        {
          "kind": "field",
          "key": "Name",
          "value": "travel ration cake~"
        },
        {
          "kind": "field",
          "key": "ShortDesc",
          "value": "東郊行糧餅(ration cake)~"
        },
        {
          "kind": "block_field",
          "key": "Description",
          "lines": [
            "一塊包著油紙的東郊行糧餅(ration cake)被放在這裡。"
          ],
          "terminator_style": "line"
        },
        {
          "kind": "field",